{
  "geofence_id": "gf-base-north",
  "policy": "NO_FLY",
  "geometry": {
    "type": "Polygon",
    "coordinates": [
      [
        [
          32.8,
          39.9
        ],
        [
          32.9,
          39.9
        ],
        [
          32.9,
          39.95
        ],
        [
          32.8,
          39.95
        ],
        [
          32.8,
          39.9
        ]
      ]
    ]
  },
  "alt_min_m": 0,
  "alt_max_m": 600
}
